{
  "schema_version": "1.0",
  "figure_id": "deep-image-prior-D-layout-C-style",
  "canvas": {
    "width": 1600,
    "height": 900,
    "physical_width_mm": 338.67,
    "physical_height_mm": 190.5,
    "background": "#FCFBFF"
  },
  "entities": [
    {
      "id": "noise-frame",
      "entity_type": "input",
      "stage": "input"
    },
    {
      "id": "noise-dot-01-01",
      "entity_type": "noise-sample",
      "stage": "input"
    },
    {
      "id": "noise-dot-01-02",
      "entity_type": "noise-sample",
      "stage": "input"
    },
    {
      "id": "noise-dot-01-03",
      "entity_type": "noise-sample",
      "stage": "input"
    },
    {
      "id": "noise-dot-01-04",
      "entity_type": "noise-sample",
      "stage": "input"
    },
    {
      "id": "noise-dot-01-05",
      "entity_type": "noise-sample",
      "stage": "input"
    },
    {
      "id": "noise-dot-01-06",
      "entity_type": "noise-sample",
      "stage": "input"
    },
    {
      "id": "noise-dot-01-07",
      "entity_type": "noise-sample",
      "stage": "input"
    },
    {
      "id": "noise-dot-01-08",
      "entity_type": "noise-sample",
      "stage": "input"
    },
    {
      "id": "noise-dot-01-09",
      "entity_type": "noise-sample",
      "stage": "input"
    },
    {
      "id": "noise-dot-02-01",
      "entity_type": "noise-sample",
      "stage": "input"
    },
    {
      "id": "noise-dot-02-02",
      "entity_type": "noise-sample",
      "stage": "input"
    },
    {
      "id": "noise-dot-02-03",
      "entity_type": "noise-sample",
      "stage": "input"
    },
    {
      "id": "noise-dot-02-04",
      "entity_type": "noise-sample",
      "stage": "input"
    },
    {
      "id": "noise-dot-02-05",
      "entity_type": "noise-sample",
      "stage": "input"
    },
    {
      "id": "noise-dot-02-06",
      "entity_type": "noise-sample",
      "stage": "input"
    },
    {
      "id": "noise-dot-02-07",
      "entity_type": "noise-sample",
      "stage": "input"
    },
    {
      "id": "noise-dot-02-08",
      "entity_type": "noise-sample",
      "stage": "input"
    },
    {
      "id": "noise-dot-02-09",
      "entity_type": "noise-sample",
      "stage": "input"
    },
    {
      "id": "noise-dot-03-01",
      "entity_type": "noise-sample",
      "stage": "input"
    },
    {
      "id": "noise-dot-03-02",
      "entity_type": "noise-sample",
      "stage": "input"
    },
    {
      "id": "noise-dot-03-03",
      "entity_type": "noise-sample",
      "stage": "input"
    },
    {
      "id": "noise-dot-03-04",
      "entity_type": "noise-sample",
      "stage": "input"
    },
    {
      "id": "noise-dot-03-05",
      "entity_type": "noise-sample",
      "stage": "input"
    },
    {
      "id": "noise-dot-03-06",
      "entity_type": "noise-sample",
      "stage": "input"
    },
    {
      "id": "noise-dot-03-07",
      "entity_type": "noise-sample",
      "stage": "input"
    },
    {
      "id": "noise-dot-03-08",
      "entity_type": "noise-sample",
      "stage": "input"
    },
    {
      "id": "noise-dot-03-09",
      "entity_type": "noise-sample",
      "stage": "input"
    },
    {
      "id": "noise-dot-04-01",
      "entity_type": "noise-sample",
      "stage": "input"
    },
    {
      "id": "noise-dot-04-02",
      "entity_type": "noise-sample",
      "stage": "input"
    },
    {
      "id": "noise-dot-04-03",
      "entity_type": "noise-sample",
      "stage": "input"
    },
    {
      "id": "noise-dot-04-04",
      "entity_type": "noise-sample",
      "stage": "input"
    },
    {
      "id": "noise-dot-04-05",
      "entity_type": "noise-sample",
      "stage": "input"
    },
    {
      "id": "noise-dot-04-06",
      "entity_type": "noise-sample",
      "stage": "input"
    },
    {
      "id": "noise-dot-04-07",
      "entity_type": "noise-sample",
      "stage": "input"
    },
    {
      "id": "noise-dot-04-08",
      "entity_type": "noise-sample",
      "stage": "input"
    },
    {
      "id": "noise-dot-04-09",
      "entity_type": "noise-sample",
      "stage": "input"
    },
    {
      "id": "noise-dot-05-01",
      "entity_type": "noise-sample",
      "stage": "input"
    },
    {
      "id": "noise-dot-05-02",
      "entity_type": "noise-sample",
      "stage": "input"
    },
    {
      "id": "noise-dot-05-03",
      "entity_type": "noise-sample",
      "stage": "input"
    },
    {
      "id": "noise-dot-05-04",
      "entity_type": "noise-sample",
      "stage": "input"
    },
    {
      "id": "noise-dot-05-05",
      "entity_type": "noise-sample",
      "stage": "input"
    },
    {
      "id": "noise-dot-05-06",
      "entity_type": "noise-sample",
      "stage": "input"
    },
    {
      "id": "noise-dot-05-07",
      "entity_type": "noise-sample",
      "stage": "input"
    },
    {
      "id": "noise-dot-05-08",
      "entity_type": "noise-sample",
      "stage": "input"
    },
    {
      "id": "noise-dot-05-09",
      "entity_type": "noise-sample",
      "stage": "input"
    },
    {
      "id": "noise-dot-06-01",
      "entity_type": "noise-sample",
      "stage": "input"
    },
    {
      "id": "noise-dot-06-02",
      "entity_type": "noise-sample",
      "stage": "input"
    },
    {
      "id": "noise-dot-06-03",
      "entity_type": "noise-sample",
      "stage": "input"
    },
    {
      "id": "noise-dot-06-04",
      "entity_type": "noise-sample",
      "stage": "input"
    },
    {
      "id": "noise-dot-06-05",
      "entity_type": "noise-sample",
      "stage": "input"
    },
    {
      "id": "noise-dot-06-06",
      "entity_type": "noise-sample",
      "stage": "input"
    },
    {
      "id": "noise-dot-06-07",
      "entity_type": "noise-sample",
      "stage": "input"
    },
    {
      "id": "noise-dot-06-08",
      "entity_type": "noise-sample",
      "stage": "input"
    },
    {
      "id": "noise-dot-06-09",
      "entity_type": "noise-sample",
      "stage": "input"
    },
    {
      "id": "noise-dot-07-01",
      "entity_type": "noise-sample",
      "stage": "input"
    },
    {
      "id": "noise-dot-07-02",
      "entity_type": "noise-sample",
      "stage": "input"
    },
    {
      "id": "noise-dot-07-03",
      "entity_type": "noise-sample",
      "stage": "input"
    },
    {
      "id": "noise-dot-07-04",
      "entity_type": "noise-sample",
      "stage": "input"
    },
    {
      "id": "noise-dot-07-05",
      "entity_type": "noise-sample",
      "stage": "input"
    },
    {
      "id": "noise-dot-07-06",
      "entity_type": "noise-sample",
      "stage": "input"
    },
    {
      "id": "noise-dot-07-07",
      "entity_type": "noise-sample",
      "stage": "input"
    },
    {
      "id": "noise-dot-07-08",
      "entity_type": "noise-sample",
      "stage": "input"
    },
    {
      "id": "noise-dot-07-09",
      "entity_type": "noise-sample",
      "stage": "input"
    },
    {
      "id": "noise-dot-08-01",
      "entity_type": "noise-sample",
      "stage": "input"
    },
    {
      "id": "noise-dot-08-02",
      "entity_type": "noise-sample",
      "stage": "input"
    },
    {
      "id": "noise-dot-08-03",
      "entity_type": "noise-sample",
      "stage": "input"
    },
    {
      "id": "noise-dot-08-04",
      "entity_type": "noise-sample",
      "stage": "input"
    },
    {
      "id": "noise-dot-08-05",
      "entity_type": "noise-sample",
      "stage": "input"
    },
    {
      "id": "noise-dot-08-06",
      "entity_type": "noise-sample",
      "stage": "input"
    },
    {
      "id": "noise-dot-08-07",
      "entity_type": "noise-sample",
      "stage": "input"
    },
    {
      "id": "noise-dot-08-08",
      "entity_type": "noise-sample",
      "stage": "input"
    },
    {
      "id": "noise-dot-08-09",
      "entity_type": "noise-sample",
      "stage": "input"
    },
    {
      "id": "noise-dot-09-01",
      "entity_type": "noise-sample",
      "stage": "input"
    },
    {
      "id": "noise-dot-09-02",
      "entity_type": "noise-sample",
      "stage": "input"
    },
    {
      "id": "noise-dot-09-03",
      "entity_type": "noise-sample",
      "stage": "input"
    },
    {
      "id": "noise-dot-09-04",
      "entity_type": "noise-sample",
      "stage": "input"
    },
    {
      "id": "noise-dot-09-05",
      "entity_type": "noise-sample",
      "stage": "input"
    },
    {
      "id": "noise-dot-09-06",
      "entity_type": "noise-sample",
      "stage": "input"
    },
    {
      "id": "noise-dot-09-07",
      "entity_type": "noise-sample",
      "stage": "input"
    },
    {
      "id": "noise-dot-09-08",
      "entity_type": "noise-sample",
      "stage": "input"
    },
    {
      "id": "noise-dot-09-09",
      "entity_type": "noise-sample",
      "stage": "input"
    },
    {
      "id": "generator-frame",
      "entity_type": "model",
      "stage": "generation"
    },
    {
      "id": "enc-block-1-back",
      "entity_type": "network-layer",
      "stage": "generation"
    },
    {
      "id": "enc-block-1-front",
      "entity_type": "network-layer",
      "stage": "generation"
    },
    {
      "id": "enc-block-2-back",
      "entity_type": "network-layer",
      "stage": "generation"
    },
    {
      "id": "enc-block-2-front",
      "entity_type": "network-layer",
      "stage": "generation"
    },
    {
      "id": "enc-block-3-back",
      "entity_type": "network-layer",
      "stage": "generation"
    },
    {
      "id": "enc-block-3-front",
      "entity_type": "network-layer",
      "stage": "generation"
    },
    {
      "id": "enc-block-4-back",
      "entity_type": "network-layer",
      "stage": "generation"
    },
    {
      "id": "enc-block-4-front",
      "entity_type": "network-layer",
      "stage": "generation"
    },
    {
      "id": "dec-block-1-back",
      "entity_type": "network-layer",
      "stage": "generation"
    },
    {
      "id": "dec-block-1-front",
      "entity_type": "network-layer",
      "stage": "generation"
    },
    {